selftext,title,id
tenho duvida de como falar algumas coisas no padrão elu/delu.,Alguem aqui sabe usar o padrão elu/delu e manja de gramatica?,zm6u78
"Gente, estou carente de amizades LGBTS!!!",PROCURANDO AMIGUES LGBTS,phxgdg
,Olá amigues! faço ilustrações digitais e estou com encomendas abertas pra presentear os afetos nesse natal com arte personalizada e cheia de carinho :),jx739z
"Não estou fazendo esse post com maldade ou para zoar, para min são perguntas legítima que eu tenho no intuito de entender esse novo fenômeno.


1)existe algum grupo de pessoas que usa a linguagem neutra fora da Internet? Tipo no contexto de fala com o atendente da padaria, pois para min parece que a linguagem neutra some nessas ocasiões.


2) vejo que normalmente quem defender a linguagem neutra se concentrar nos pronome e na mudança da vogal temática.

Mas só essas mudanças não faz a língua fica neutra, já que no português, o artigo que acompanha a palavra também define o gênero, por exemplo:

O motorista.

A palavra acaba com A, mas mesmo assim é masculino.

Ou mais ironicamente a frase 'o amigue' ainda é masculino por causa do artigo que acompanha.

Como fica a linguagem neutra nessas questões?

3) o que acontece com palavras que não tem como deixa neutro, como por exemplo: mãe/pai?


Agradeço pelo compreensão de todos,todas e todes.",perguntas sinceras para quem defender a linguagem neutra,q8mfyj
"Por favor, sem falar que gênero neutro é errado, pois sou não binário é vejo que é necessário pelos meus iguais. (Uso pronome masculino)

Antigamente eu era praticamente contra o uso de ""todes"", o resto da linguagem neutra era plausível, mas o que me pegava era a única palavra ""todes""

Vocês acham que usar ela é crucial pra introduzir o gênero neutro? Ou é melhor manter o ""todos""? Já ouvi que ""todos"" não é inclusivo, mas não consigo imaginar o porquê, já que desde os primórdios usamos ele pro plural geral.","Sobre o uso do termo ""todes"" da linguagem neutra",ppsr66
"eu escolhi hoje meu novo nome, que é Olive (lê-se Ólive) e vem com um apelido muito lindinho de brinde, que é Oli. já tem muito tempo que eu sinto um incômodo quando me chamam pelo meu nome de registro mas nunca tinha tido coragem de mudar porque tinha medo de ninguém respeitar meu novo nome. mas esses últimos dias estive refletindo, tomando coragem e vendo alguns nomes mais neutros, e decidi que Olive é um nome lindo e acho que combina comigo. já contei pra vários amigos e todos me apoiaram e falaram que mesmo que possam errar no início, vão dar o seu máximo pra se adaptar por mim. não existe sensação melhor do que essa, só os amigos, amigas e amigues trans vão entender como é sentir isso. tô quase pulando de alegria, sério",escolhi meu nome social e tô muito feliz!!,zt5m6y
"hoje, dia 29 de janeiro, é o dia nacional da Visibilidade Trans e Travesti aqui no Brasil. só queria passar pra dizer a todos os outros amigos, amigas e amigues trans do sub que vocês são pessoas incríveis e maravilhosas. apesar de ainda sermos o país que mais mata pessoas trans no mundo, isso não deve ser motivo pra nós abaixarmos nossas cabeças porque ainda virão muitas lutas e conquistas pela frente. eu sei que alguns dias podem ser mais difíceis do que outros, mas eu espero que juntes nós consigamos passar por isso. um beijão pra todo mundo. ❤",dia da visibilidade trans e travesti,10onjxx
"Então, seguinte kkkkk:

Eu (19H) fui na casa do meu avô assistir o jogo do Corinthians (somos corintianos), assistimos e pá, tudo bem Corinthians ganhou mto ótimo ficamos felizes.

Ele foi me trazer de volta pra minha casa, um período curto, resolvi que aquela era a hora de colocar as cartas na mesa, comecei na maciota

""Pois é, o próximo a se casar da família sou eu"" (Minhas tias e primas já estão todas casadas)

E ele:

""Pois é, mas por que você tá dizendo isso?""

Eu:

""Ah, só por dizer""

Ele:

""Por quê? Já tem uma companheira""

[gay silence]

""Tem uma companheira? Companheira ou companheiro?""

""Não, não tenho não, se fosse companheiro teria algum problema? kk""

""Não, nenhum, eu quero te ver feliz""

Aí chegou a grande hora: ""então, queria te dizer que eu sou bissexual""

""Sério? Mas como você sabe disso?""

""Ah, é que... Eu namoro um homem já faz um tempinho""

Daí pra frente minhes amigues, foi só coisa boa:

""Eu te aceito "", ""Quero te ver feliz"", ""Já tinha minhas desconfianças"", ""Pode contar comigo pra tudo""

Eu chorei no ombro dele, me despedi, tomei um banho e agora estou aqui, completamente feliz e eufórico, sem ainda acreditar em nada daquilo.

E foi isso gente, queria compartilhar isso com vocês, de passo em passo a gente chega em Roma kkkkkk",EU SAI DO ARMÁRIO PRO MEU AVÔ PQP EU TO MTO FELIZ,xfe5gv
eh so isso msm bjs tchau,esperam q estejam todes bem,wopkzh
"Inventei de fazer um instagram e postar uns look diferentão, tipo usando umas roupas de minininha, salto alto, etc (sou um homem masculino machão barbudo). Criei a conta com o número do celular porque é era mais rápido... E não é que meus amigos e família tudo me acharam!?!?

Descobri que o instagram recomenda pessoas para seguir baseado nos contatos do teu telefone. Ou seja, recomendou-me pra minha família e amigos. Ainda bem que não postei nenhuma foto de calcinha (não deu tempo), MAS FOI QUASE.

Eles desconfiavam que eu era viado, agora tem certeza

Fica a dica ai amigues, abraço!",Não loguem no instagram com o número do telefone e poste uma foto de calcinha. Pior erro da minha vida,uwrwfz
[https://docs.google.com/forms/d/e/1FAIpQLSeHSZs9WRC5v7LkgumPlhudTX8iMlwKZSZUdtM\_xbmf7ZbZ5A/viewform?usp=sf\_link](https://docs.google.com/forms/d/e/1FAIpQLSeHSZs9WRC5v7LkgumPlhudTX8iMlwKZSZUdtM_xbmf7ZbZ5A/viewform?usp=sf_link),Olá a todes! Sou uma estudante polaca da filologia portuguesa e escrevo a minha dissertação sobre a linguagem da comunidade LGBTQIA+ em Portugal e no Brasil. Podem preencher este inquérito? Isso ajudaria me muito,o9kw8e
"Alguém tem indicação de textos acadêmicos escritos por pessoas trans? Preferencialmente sobre transexualidade, mas se tiver de outras temáticas também é bem-vindo. Serve indicação de autores tbm. 
Eu e ume amigue estamos tentando criar uma pasta no drive apenas com autores trans, para que a gente possa se apoiar dentro da academia também. Além disso, estou fazendo meu TCC sobre educação inclusiva para adolescentes trans e não quero me basear em pessoas cis como referencial teórico. Dei uma pesquisada mas encontrei pouca coisa, principalmente de gente do Brasil. 
Sério gente, qualquer indicação é válida :)",Indicação de autores trans que produzam textos acadêmicos,ilz253
"Ano passado eu me descobri uma pessoa não binária e eu fiquei com uma dúvida na minha mind 

Eu sei que orientação sexual e identidade de gênero são coisas super diferentes uma da outra porém... Eu gosto de garotos só que eu não sei se eu me classifico como homossexual pq eu nem me identifico como um homem kkkk será que tem alguma pessoa nb por aqui que já pensou nisso? Poderia me ajudar? 

Beijo a todes 😊",Uma pessoa não binária em apuros,1071lpm
"Lembrando, eu sou uma pessoa não binária de pronomes ele/ela/elu","E quando a pessoa não se identifica com os seus pronomes, como faz?",10vctgu
"Amiges,

vcs já fizeram? Compartilhem as experiências! Estou interessade em fazer agora no RJ com terapeuta homem que atenda homem... Mas com aquele calorzinho de insegurança! Vou adorar saber mais da experiência de quem puder compartilhar!

Beijim nataline... x) a todes!!!!",Massagem tântrica,zv4pcj
"Gente, não entendo porque tipo, tem gente que dá tanta importância pra quem é lgbt, tipo se você fala é do vale pra quem é hetero, elu fala ""ah é? Como é? Como foi quando se descobriu?"" tipo, é só uma característica nossa, se por exemplo, fala que curti sertanejo, de boa, se gosta de filme de romance, suave, mas se fala que é do vale, já faz um estardalhaço, chega ao ponto de querer ajudar, tipo "" sabe aquela mulher? Então ela é lésbica, talvez vocês se deem bem"" não to reclamando, é só que tipo, iria facilitar pra caramba as coisas pra nós se quando descobrirem, tratar com naturalidade ao invés de dar tanta importância.


Não to reclamando, é só minha opinião.",Porque as pessoas dão muita importância pra um detalhe?,zokle7
,Fiz uma comunidade LGBTQIAP+/Queer no Discord pra todes nós! 🙂,guonv0
"Qual tipo você geralmente prefere e mais te atraí? Não precisa ser uma regra, apenas uma preferência, e tenha respeito :)!

[View Poll](https://www.reddit.com/poll/zaste3)",Qual seu tipo de homem que preferes?,zaste3
,Feliz orgulho pra todes de BH hj!,cd34vb
"Queria saber como vocês meninas trans, ou rapazes e outres… se detém com fé, Cristianismo e etc…

E se possível fale um pouco como foi se aceitar assim já tendo uma fé ou adquiriu a fé depois?

PS: pergunto por ser de família cristã, ter 26 anos e me identificar como menina trans e a fé ser importante para mim.

Grata a todes!!",Como vocês lidam com fé e religião no caso de ter ou seguir uma…?,xjseas
"Olá, esse é meu primeiro post aqui, então disfarcem se eu cometer alguma vergonha.
Me entendo como não binário desde os 16 anos (hoje tenho 23), quando descobri no meu TCC que não existia apenas homens e mulheres cis.
Bom, meses atrás namorava com um homem cis e um dia em uma conversa entre amigos falando sobre a sexualidade de cada um, perguntamos para ele se ele era bi ou pan. Pra surpresa de todos, ele ficou extremamente irritado, dizendo que era Hétero e que ninguém poderia contrariar ele e depois disso encerrou o assunto, dizendo que viraria briga se continuássemos.
Até hoje não entendo como um Hétero aceitou namorar por mais de 3 anos com uma pessoa não binária assumida. Isso é possível? Homens heteros não namoram especificamente mulheres cis ou trans? Será que ele idealizou em mim uma mulher que não existe? Gostaria de conselhos e opiniões.",Hétero namorando não binário?,z38o3f
"Olá pessoal!

Reconhecendo a baixa adesão do pública LGBTQIA+ no /r/brasil viemos por meio deste tópico solicitar sugestões de como criar uma comunidade mais receptiva para este público.

Se tiverem qualquer pergunta nos disponibilizamos a respondê-las!

Desde já agradecemos a atenção e desejamos uma ótima semana a todes. 

_Conversamos previamente com a moderação do sub e eles liberaram esta postagem_

Moderação do Brasil",Sugestões para a moderação do /r/brasil,vnlots
"oi, tudo bem?

eu vim fazer esse post pq eu n tenho ninguém pra conversar ou falar disso, afinal eu sou a unica pessoa trans q eu conheço

eu me identifiquei como um homem trans pelos ultimos 5 anos e mesmo me sentindo confortável com esse rótulo(pelo menos mais confortável do que como uma muher cis) sempre pareceu que faltava algo 

eu gosto de coisas ""de menina"" tipo pintar a unha, maquiagem e agora eu tenho pensado em usar saia  e vestido(em um ambiente que ninguém fosse me tratar no feminino)mas eu sempre ignoro esses pensamentos e finjo q n gosto dessas coisas n sei exatamente pq

recentemente tudo isso ficou mais forte quando um grande idolo meu entrou em contato com a sua feminilidade mais usando um vestidinho num show essa semana(lindo queria usar) e eu comecei a nao conseguir parar de pensar nisso e entrei numa crise existencial, de identidade sei la

eu uso pronomes ele/dele ha um tmpo mas acho q gostaria de usar ele/delu(mesmo que por algum motivo em ingles fique melhor, he/they parece melhor mesmo q isso n faça sentido algum) e nao sei oq isso faz do meu genero

n sei mais meu genero kk

meus pensamentos de me machucar ou coisa pior tao mais fortes e eu to ficando com nojo de mim

se algm puder me ajudar eu agradeço muito, seja conversando ou aconselhando pq eu realmente to mal e perdido",eu to completamente perdido sobre o meu genero,wz37sr
"Vi uns textos por aqui onde usaram 'x' ou '@' no lugar de vogais ('a' e 'o') para expressar uma linguagem de gênero neutro. Isto torna o texto muito difícil de ler, além de ser impronunciável. Por isso venho compartilhar o [Manifesto ile para uma comunicação radicalmente inclusiva](https://diversitybbox.com/pt/manifesto-ile-para-uma-comunicacao-radicalmente-inclusiva/), onde é recomendado o uso de 'e' como vogal para gênero neutro e 'ile' como pronome.",Manifesto ile para uma comunicação radicalmente inclusiva,lvchbk
"O quão indelicado é achar uma pessoa gostose por suas características femininas? Isso é uma barreira ou eu devo encarar com honestidade na hora de conhecer alguém e me interessar?

Aceito sugestões de leitura! sou novo no vale (Demi, ainda não inteirado de todo o espectro ace mas definitivamente não allo)",Conhecendo pessoas não binárias,yl2ka1
"Uns 4 ou 5 anos atrás eu criei esse sub como uma necessidade de me comunicar mais com pessoas como eu. Com o tempo eu perdi a capacidade de acompanhar de fato a moderação e pensei várias vezes em sair mas fiquei porque achei que ia virar um caos total sem pelo menos o pouquinho que eu tava conseguindo fazer. 

Uns 6 meses atrás eu fiz um post pedindo voluntaries para a moderação para eu poder me aposentar. Finalmente achei uma turma legal para ser mod aqui e vejo que o sub está funcionando ok e eu posso finalmente falar tchau. 

Eu vou ficar por aí de vez em quando, mas vou aposentar esse alt para evitar doxxing e etc. A gente sê vê, beijinhos a todes.",Tchauzinho amores.,tk3p9r
,"Alguém conhece elxs? Tirei umas fotos na Parada LGBTQIA+ que teve em Floripa dia 11 e essas tão entre as minhas preferidas, então queria poder enviar pra elxs.",xib3r6
"A sigla foi se alterando ao longo dos anos para enquadrar mais grupos dentro da comunidade. Do GLS,  cresceu até LGBTQIA+. O pretexto sempre foi: ""a sigla atual não abrange a todes. Vamos aumentar uma letra para incluir mais pessoas"".

O problema na minha visão é que a partir do momento em que a sigla termina com um ""+"", ela já parte de que não conseguiremos incluir todo mundo. Vide que ainda existem grupos que não estão na configuração atual da sigla. Além disso a sigla é longa. No meu cotidiano eu me pego falando LGBT por ser mais rápido. Não é difícil ver gente inclusive tirando sarro, chamando de LGBTABCDEFGH.

Aonde eu quero chegar? Na minha humilde opinião, eu penso que seria melhor referir-se a comunidade como Queer, ou alguma outra palavra que abranja todas as outras categorias que se opõem a heterocisnormatividade. Talvez essa palavra não represente absolutamente todo mundo? Talvez mas LGBTQIA+ também não abrange direito. Só que Queer é muito mais rápido kkkkk.

Não tô tentando excluir ou unificar os diferentes grupos que existem dentro da nossa comunidade. Só tô levantando uma reflexão que eu tenho há tempos, mas não consigo conversar sobre com os meus amigos gays sobre, pois eles não poderiam ligar menos kkk.

O que vocês pensam sobre isso? Eu estou cagando pela boca? 

tl;dr: Não é mais fácil falar Queer em vez de LGBTQIA+?",Vocês concordam que a sigla LGBTQIA+ não é muito prática?,rxk26y
" >!Eu não sei... Me sinto desconfortável com meu sexo biológico, e fico me perguntando como tira isso de mim... Fico pensando, eu sou uma mulher ainda com isso me assombrando? Por que até hoje ninguém se manisfestou em tirar isso Por que não saiu nenhum artigo falando sobre isso? Sou uma mulher ainda? Isso me define como mulher? O que eu sou? Uma anomalia? Uma mulher com sexo biológico masculino de merda? O que os cientistas/biólogos pensam disso? Pensam que eu sou homem e blá blá por que tenho um esgoto, um lixo podre dentro de mim? Ou pensam que eu sou mulher sim e mostram várias explicações e fatos dizendo que sou mulher sim? são apenas demônios, assim como disforia, um demônio maior. Assim como transfobia. ""Você não é mulher, você não tem útero!!!"" Cada vez que escuto isso, eu tento pegar uma faca e tirar isso de mim dente por dente. Não sei se vou aguentar por muito tempo isso, antes de ontem planejei em me matar se entupindo de remédios. Eu acompanho o Yago Stephano, ele é um ótimo biólogo animal etc. Vi pessoas fazendo duetos dele sobre lgbt e tals... Não entendi muito bem, mas tem um que tem tema ""sensível"" na minha visão e percepção pelo menos, sobre xx, xy, gravidez e não sei o que, tinha até o Átila ali. Eu amo o conteúdo dele, mas o que ele pensa de pessoas trans? Talvez seja paranóia minha... Mesmo eu tendo meu sexo biológico masculino, eu não deixo de ser mulher e muito menos sou menos mulher por isso. Eu sou mulher sim, meu sexo biológico não anula quem é a mulher que eu sou. Eu tenho orgulho de ser a mulher que eu sou hoje, sou guerreira, sou forte e lutadora...olha o que eu passo todo dia, olhe meu sofrimento... Já desisti várias vezes; porém, eu porque Deus não me ajuda? Eu aceitei ele faz tempo, tenho minha fé... Mas ele nunca faz nada, ele não está bem aí sabe? Ele não existe, não existe. Nunca me ajudou com nada. A Transfobia e Machismo que sofro me faz uma pessoa muito triste, sem amigos e até mesmo sem olhar na cara de pessoas, sentindo medo olhando pra todas elas, só olho pro chão. Me chamando de Traveco, Homem, macho, vadia, puta de merda, Femboy, Trap, me chamando de puta, mulherzinha de merda, mulherzinha fresca... Eu sinceramente não concordo em falar que o mundo está evoluindo, porque ele está evoluindo ao contrário. Pessoas ofendendo e xingando outras pessoas e usa do o argumento de que sou militante lacrador que é apenas uma opinião... Eles não passam o que eu passo na pele, é lógico que falam assim de mim e de outras pessoas como eu. Minha ansiedade social me deixou tão insegura que não consigo olhar pra cara de absolutamente ninguém na rua, só olhando pro chão e mais nada. Isso que eu tô a 7, 8 anos sem sair de casa por conta disso, tento que eu nem sei fazer contas de moeda, ou no cartão e até mesmo ir no shopping, parque, padaria etc, só saio de casa pra ir na escola ou em ir em algum lugar obrigatório, eu tenho literalmente uma FOBIA de pessoas. As coisas que eu sinto ultimamente são essas: Ansiedade, Apatia, Culpa, Descontentamento Geral, Desesperança, Mudanças de humor, Solidão, Tristeza, Tédio, Sonolência, Repetição Incessante de pensamentos, Falta de concentração, Lentidão, Ansiedade social, Depressão, TDA, Agonia, Dor, Atraso, Desorganização, Transfobia, Machismo, Exclusão de amizades. Será que eles tem razão me chamando de homem por eu ter de fato um sexo masculino biológico e não puder remover isso por que simplesmente seria impossível retirar? Será que eu sou mulher, mesmo que eu tenha sexo biológico masculino e órgão genital masculino? Eu sei que sou mulher, mas tenho dúvidas se isso me define mulher ou homem... Eu quero tirar a força isso de mim, pois eu não aguento mais, isso foi um desastre que Deus e a natureza colocou em mim, eu quero ser uma mulher (eu sei que sou) sem essas coisas dentro de mim. Queria que os biólogos descobrissem uma forma de provar e afirmar que dá pra tirar isso. Eu tô em uma situação destrutiva dentro de mim mesma, olha os desabafos... Eu duvido que algum biólogo diria realmente que sou mulher só por eu ter cromossomo xy, genitália masculina... Duvido muito, por que iria me abalar mais se ele/ela/elu dissesse que não sou mesmo me aceitando, entendendo, sentindo e afirmando que sou. !<","Gatilho extremo do extremo e pesado. Assuntos envolvidos: Tr***fob** depre**** suici***multila*** biologia, disf**** AVISO: Antes de olhar meu desabafo, isso é um assunto delicado, desconfortável pra muitas pessoas. então se você tem gatilho com isso, não veja meu desabafo e ignore, é bem pesado.",wnhbw9
"criei essa enquete pra unirmos nossos últimos neurônios e resquícios de sanidade pra saber o seguinte: você sabe em quem vai votar em 2022 (considerando todos os cinco cargos em disputa) e, se sim, els candidaties têm como planos o bem-estar de minorias sociais, como a nossa comunidade?

caso queira, aproveita pra compartilhar candidaties que visam atender nossas necessidades, além de vídeos, artigos, matérias, etc., sobre o assunto, por favor! :)

[View Poll](https://www.reddit.com/poll/vtpnb2)",CONSCIÊNCIA POLÍTICA: EM QUEM VOCÊ VOTARÁ EM 2022?,vtpnb2
"Bom dia querides!

Eu tenho um sonho desde menina quando me descobrir de administrar um bar lgbt, um lugar onde todes possam se sentir bem. Sei la um lugar q a galera pode ir e ficar de boa e tal. Sei que no passado nossa comunidade sobreviveu nesses lugares, mas hj n sei se eles ainda conseguem se manter, financeiramente, com essa temática. 

Quais são suas opiniões? Quero ouvir a todes!

Obrigada.",Ainda é rentável ter um bar/restaurante/gastropub LGBTQIA+?,te7vdp
"Oioi, bom dia a todos, todas e todes 💗
Então, eu nunca me ""assumi"" com sexualidade nenhuma (mesmo me indentificando como pan), meu primeiro namoro foi na escola com uma garota (que inclusive foi babaca comigo e me trouxe altos traumasKKKK), e não cheguei a namorar mas já fiquei com meninos também.
Esqueci dizer que sou uma garota cis também 👍
Esses dias minha amiga disse ""eu não consigo te imaginar namorando uma menina, desculpa"", fiquei bem tristeKKK, mas eu realmente não fico com absolutamente ninguém, eu deveria me ofender com o que ela disse?",Minha amiga duvida da minha sexualidade (?,tbrhhi
"Olá a todes!  

Moro em Portugal e meu médico de família tomou diversas atitudes na última consulta e que são caracterizadas como assédio moral (entre elas xingamento, gritos e até tirou a máscara durante um grito). Entrei com denúncia no centro de saúde, pedi mudança de médico (foi atendida) e levei o caso à Ordem dos Médicos. 

Agora, tal Ordem me pede provas testemunhais, que eu não tenho, porque a enfermeira diz não ter ouvido nada (ela estava na sala ao lado, claro que ouviu, mas não quer falar... enfim). Numa outra ocasião, rolou assédio sexual também, porém o FDP falou tão baixo que só eu e ele sabemos o que foi dito, e obviamente não tenho como comprovar isso também.

**Estou buscando artigos acadêmicos que abordem não só o conceito, como outras situações em que assédio moral é difícil de comprovar.** Minha ideia é pedir para que a Ordem entenda que tal denúncia nem sempre tem testemunhas e, portanto, **avaliar o caso por outras  vias.** Alguém sugere algo?? Encontro muito material sobre assédio em ambiente de trabalho, principalmente entre funcionários da saúde, mas nada sobre as vítimas e seus processos (inclusive jurídicos, se for o caso).",Assédio moral em Portugal,mqpk0k
"Boa tarde a todes, a moderação recentemente me permitiu que eu divulgasse aqui um sub novo que eu fiz para falar do tema “sexualidade”.

Mesmo já existindo o r/arco_iris para falar desse tema, com certeza também é bom ter variedade para falar do assunto que é um tanto quando amplo.

Divulgo aqui o r/transa, porque o... aquele outro nome já estava em uso. O sub não é para conteúdo explícito nem conversas sobre o ato de transar no geral, e sim para tudo que possa envolver sexualidade e identidade de gênero.

Quem estiver disposto a popular o novo sub & se juntar à moderação, por favor me chamem no chat ou DM.

Agradeço muito a todos que puderem se juntar nessa ideia de fazer um sub amigável para todos aqueles que buscam por descobertas que não cabem em um sub só! 🏳️‍🌈",Criei o r/transa para falar de sexualidade em geral,msu94l
"infelizmente no nosso meio, as pessoas usam máscaras e nunca se mostram totalmente

conheço gays que não são confiáveis, não querem relacionamento nenhum e mesmo assim insistem na pose como que tentando se mostrar alguem melhor do que realmente é, sendo que no fundo só querem sexo e manipular o parceiro 

existe alguma estratégia que vocês desenvolveram para filtrar esse tipo de gente?

desde já agradeço a participação de todes","gays, com o vcs reconhecem uma pessoa com potencial para algo sério",ktnbpq
