selftext,title,id
,"ola, essa sera meu primeiro post q eu faço na vida kkkkk (to falando serio ;-;), eu sou Alanna e tenho 14/15 anos, e eu entrei pro mundo n binarie faz pouquisimo tempo kk, está sendo muito estranho para algumas pessoas do meu cotidiano se referirem a mim como elu delu.. mais eu fico feliz com apoio",yxc086
"oi!! meu nome é Tuna, eu sou não-binárie (pronomes ela/ele/elu) e artista de quadrinhos :\] ainda tô fazendo minhas primeiras HQs, mas gosto de usar as histórias pra aumentar a visibilidade não-binária e normalizar o uso de pronome neutro, especialmente em português. tô aqui pra compartilhar meu primeiro quadrinho, Mãe! e protagonista se chama Izumi e usa os pronomes elu/delu. isso é tratado com normalidade e respeito ao longo de toda a história! a HQ em si fala sobre a viagem delu pro inferno atrás da mãe que elu nunca conheceu. o quadrinho pode ser lindo online de graça e tá recebendo atualizações frequentemente. se vc tiver se interessado, os links tão abaixo! obrigado pela atenção!

🔥 [https://twitter.com/\_gatodefranja/status/1583975393006014465](https://twitter.com/_gatodefranja/status/1583975393006014465) (inglês e português)

🔥 [https://tapas.io/series/mae-em-portugues](https://tapas.io/series/mae-em-portugues) (português)

🔥 [https://tapas.io/series/mae-english-version/info](https://tapas.io/series/mae-english-version/info) (inglês)

&#x200B;

https://preview.redd.it/xnp3ykw7hlw91.png?width=2007&format=png&auto=webp&v=enabled&s=6bc12654767fee558815fc25b48101b9556dbd37",webcomic legal com protagonista não-binário!,yfxnx2
,Olá a todes! Sou uma estudante polaca da filologia portuguesa e escrevo a minha dissertação sobre a linguagem da comunidade LGBTQIA+ em Portugal e no Brasil. Podem preencher este inquérito? Isso ajudaria me muito,o8wm64
"Bom dia, tarde ou noite dependendo de quando vocês tão vendo isso, galera! Meu nome é Luci, e eu me identifico como não-binário faz bastante tempo já (uso os pronomes Ele/Dele e Elu/Delu, Ela/dela só pra pessoas que me conhecem bem, porque eu não gosto muito desses pronomes). E honestamente, é um inferno na Terra se identificar como não-binário com pais conservadores, que não te deixam nem cortar o cabelo porque ""vai contra a religião deles"".

Eu tenho certeza que, se eles não fossem conservadores, eu poderia viver na internet em paz, mas NÃÃÃÃÃÃÃO, eles querem que eu seja a princesinha delicada deles, ao ponto de eu só receber declarações de amor de homens cis e héteros, tanto na vida real, quanto na Internet. Inclusive, tô escrevendo esse post escondido.

O que eu faço pra eu finalmente transicionar e ter a aparência alinhada ao masculino que eu sempre quis, e ser deixado em paz????",Acabei de entrar e já tô desabafando,ryjnfi
"Eu acho que essa seria a melhor maneira de resolver esse negocio de "" Pronome Neutro "" e também de evitar o "" Genérico Masculino "" que o Português atual usa... 

Esse negocio de "" Elu "" "" Delu "" "" Elx "" e "" Delx "" soa muito estranho e eu acho que esse é um dos motivos pelo qual quase ninguém usa e porque fazem tantas piadas com isso... :\\ Sem dizer que no caso de "" Elx "" e "" Delx "" também tem a questão de ser ininteligível para softwares que ajudam as pessoas cegas baseado no que eu ouvi falar...

Por outro lado a letra ""Æ "" é uma fusão das letras "" A "" e "" E "" então seria uma alternativa boa para as palavras aonde o feminino usa "" A "" e o masculino usa "" E "" como "" Elæ "" e "" Delæ "" ao inves de "" Ele "" e "" Ela "" "" Dela "" e "" Dele "" ... 

É claro ainda vai ter a questão das palavras masculinas que terminam com "" O "" ao inves do "" E "" mas já seria um começo pra resolver alguns desses problemas sem fazer a nossa língua ficar muito estranha... Eu sempre senti que a letra ""Æ"" pudesse ser uma boa solução para alguns dos problemas de gênero da língua Portuguesa... 

A letra ""Æ "" já é usada em alguns países : [https://pt.wikipedia.org/wiki/%C3%86](https://pt.wikipedia.org/wiki/%C3%86) 

Então que tal adicionarmos o Æ e æ ao Português também? Afinal o Português já tem letras diferentes como "" Ç "" ...

Senhoras e Senhores... Senhoræs... :)","Hey pessoal! Que tal fazermos uma petição para adicionar a letra "" Æ "" e "" æ "" aos teclados dos PCs brasileiros?",oor2qw
,"Bom dia a todes ✨. No dia do orgulho dei uma entrevista para um mestre em psicologia. Acho valioso quando profissionais da saúde buscam conhecer nossa comunidade e nos dar voz. Se quiserem escutar, tem o link:",hjx7m0
"Bom, eu tive a ideia de criar uma corrente aqui, eu começo me apresentando, e, se vc estiver à vontade, vc faz o mesmo :)

Vamos lá: Meu nome é Yuri (mais conhecido como Yaoi, kk) e eu sou não-binárie pansexual e meus pronomes são elu/delu (eu agradeceria se vcs pudessem usá-los).

Eu gosto de: Filmes, séries, animes, ler, mangás, cultura oriental (principalmente japonesa), e jogos, principalmente jogos retrô, discutir sobre a vida, etc.

Eu não gosto de: Preconceito, ficar no vácuo (kkkk), jogos pay-to-win, acordar cedo, dormir cedo, discussões agressivas, extremismo, etc.


Bom, eu contei um pouquinho de mim, e, se vc quiser compartilhar um pouco de vc conosco, fique à vontade, sem julgamentos aqui ;)",Me apresentando :),g3aybx
